{
  "id": "email:demo-001",
  "channel": "email",
  "direction": "inbound",
  "timestamp": "2026-10-06T09:15:00-07:00",
  "participants": [
    { "role": "from", "handle": "alice@example.com", "display_name": "Alice" },
    { "role": "to", "handle": "me@example.com", "display_name": "Me" }
  ],
  "thread_id": "email-thread-42",
  "content_text": "Hi, let's meet Thursday 3pm. My phone is 13812345678 if you need to call. Tracking SF1234567890CN.",
  "sensitivity": "personal",
  "consent_tag": "demo-consent-2026-10",
  "raw_ref": null,
  "metadata": { "subject": "Thursday meetup" }
}
